,State,Job,Companies,Location,Summary,Salary,Links,Post_Date,og_salary_period
488, karnataka,staff engineer   machine learning   customer engineering,qcom,bengaluru  karnataka,live and breathe quality software development with excellent analytical and debugging skills  strong understanding of deep learning fundamentals ,,/rc/clk?jk=80a7cccbd07b9b81&fccid=d40ebe11fc879426&vjs=3,08-10-2022,
489, karnataka,machine learning engineer,52 qualcomm india private limited,bengaluru  karnataka,engineering group  engineering group > machine learning engineering  understanding various frameworks and solutions to integrate qranium software stack within…,,/rc/clk?jk=dd1c0df500068b3e&fccid=dd616958bd9ddc12&vjs=3,08-10-2022,
490, telangana,data science manager  payment risk,amazon dev center india   hyd,hyderabad  telangana,4  years of experience managing data scientists  including intermediate managers  10  years of experience working in data science in a consumer product company ,,/rc/clk?jk=e1ba890556008ec6&fccid=fe2d21eef233e94a&vjs=3,08-13-2022,
491, karnataka,principal associate  model risk management,capital one,bengaluru  karnataka,2  years of experience in r or python for large scale data analysis  you have hands on experience developing data science solutions using open source tools and…,,/rc/clk?jk=5a593a4713ee56de&fccid=b85c5070c3d3d8c8&vjs=3,08-09-2022,
492, karnataka,business intelligence engineer,adsipl   karnataka,bengaluru  karnataka,understand a broad range of amazon’s data resources and processes  the ideal candidate has deep expertise in gathering requirements and insights  mining large…,,/rc/clk?jk=a7d6ea66db5900eb&fccid=fe2d21eef233e94a&vjs=3,08-09-2022,
493, delhi,ai engineer  3  years   remote,michael page,remote in delhi  delhi,master's  engineering school or phd in data science  ia or computer science  this group is the first alliance of quality management specialists in their fields…,,/rc/clk?jk=7c0b9e0870d0f78b&fccid=77087bd1709a8148&vjs=3,08-14-2022,
494,telangana,lead analytics consultant,wells fargo bank,telangana,ability to leverage data visualization tools and alternative front end solutions to delivering data  provide exploratory data analysis using sql ,,/rc/clk?jk=e6ab8bfafe473f60&fccid=78bbcd26e39621f5&vjs=3,08-10-2022,
495, karnataka,machine learning engineer senior   customer engineering,qcom,bengaluru  karnataka,enable pre trained ai models on customer devices framework  to be able to show demo with pre trained models for respective use cases on android linux ,,/rc/clk?jk=e469dbb41372e9b9&fccid=d40ebe11fc879426&vjs=3,08-10-2022,
496, maharashtra,sr manager  presales : big data,databricks,mumbai  maharashtra,knowledgeable in and passionate about data driven decisions  ai  and cloud software models  as a senior pre sales manager  strategic accounts  data   ai  will…,,/rc/clk?jk=6eaac25ba0ed14fd&fccid=3d0f7ba22a49432f&vjs=3,08-09-2022,
497, tamil nadu,pms analytics business analyst expert,philips,hybrid remote in chennai  tamil nadu,experience in designing and building dimensional data models to improve accessibility  efficiency  and quality of data  technical knowledge and skills required ,,/rc/clk?jk=e53117cf10e8a576&fccid=e4af9ca5b6d3a604&vjs=3,08-09-2022,
498, delhi,consulting business operations cloud engineering manager mac   ,deloitte,delhi  delhi,services include readiness  strategy  business case development  architecture and planning  governance and policy  and operating model transformation ,,/rc/clk?jk=49e8aa24323d6181&fccid=9e215d88a6b33622&vjs=3,08-13-2022,
499, karnataka,manager marketing performance and analytics,merck kgaa darmstadt germany,bengaluru  karnataka,ensure data accuracy and completeness by performing quality data audits and analyses  bachelor's degree in marketing  computer science  business  economics …,,/rc/clk?jk=002614ff78a5706e&fccid=68d0e0954a811351&vjs=3,08-11-2022,
500,remote,principal statistical programmer,iqvia,remote,creates programming specifications  program development  program validation  and program output finalization associated with analysis datasets  tables  figures …,,/rc/clk?jk=5001b7e8bdfe1595&fccid=6b7a1dfe07e7f037&vjs=3,08-11-2022,
501, haryana,sde iii  backend and machine learning ,expedia group,gurgaon  haryana,strong experience with data science packages and ml frameworks  optionally  1 2  years hands on ml data science experience  ideally delivering projects…,,/rc/clk?jk=c0f009ac39459150&fccid=160efb82f2462f14&vjs=3,08-13-2022,
502, maharashtra,senior consultant   supply chain analytics,general mills,remote in mumbai  maharashtra,experience in data bases to handle large data sets such as sql  ms access or similar   nice to have  synthesize large data sets model results into usable…,,/rc/clk?jk=926bfdeb56f91060&fccid=3bcf7eb192e678e4&vjs=3,08-10-2022,
503, haryana,assistant manager   data scientist,genpact,gurgaon  haryana,create additional data attributes under guidance from data scientists  domain experts  combine data extracted from multiple sources into a unified data mart for…,,/rc/clk?jk=cd7c086e375b648a&fccid=afe30394bfba1470&vjs=3,08-11-2022,
504, maharashtra,senior manager,bank of america,mumbai  maharashtra,7 years of relevant experience using sas  sql for data analytics  analyze data to determine root causes and summarize client  revenue and regulatory policy…,,/rc/clk?jk=37ac7d21a6d8c3ec&fccid=5bd99dfa21c8a490&vjs=3,08-13-2022,
505, karnataka,machine learning engineer senior   customer engineering,52 qualcomm india private limited,bengaluru  karnataka,enable pre trained ai models on customer devices framework  to be able to show demo with pre trained models for respective use cases on android linux ,,/rc/clk?jk=97cb66c391d76dd2&fccid=dd616958bd9ddc12&vjs=3,08-10-2022,
506, maharashtra,analytics specialist  enterprise technology group,sony pictures networks,mumbai  maharashtra,reporting to head   infrastructure   analytics  enterprise technology group   the incumbent will jointly build and design the analytics roadmap for the next 2…,,/rc/clk?jk=5db18de3bd61efe4&fccid=87296c430fc584e1&vjs=3,08-11-2022,
508, karnataka,sr engineer i  sw   ai  nlp  computer vision,harman international,bengaluru  karnataka,appx 4 6 years of experience in automotive domain with good exposure to ai ml required  it’s preferred to have some visualization tools knowledge or experience ,,/rc/clk?jk=ee6b2fe89b9572a4&fccid=4faf342d2307e9ed&vjs=3,08-09-2022,
509, karnataka,senior data science engineer,sabre,bengaluru  karnataka,the prime objective is to get data from multiple sources and provide data insight to customers in the form of reports  charts  dashboards etc ,,/rc/clk?jk=5e615d7d7dfa3f77&fccid=05fac7ab69452ba3&vjs=3,08-09-2022,
510, uttar pradesh,data scientist job stage 9,ericsson,noida  uttar pradesh,acuity for business flow understanding and expertise in data preparation data mining and pre processing and documentation skills ,,/rc/clk?jk=8586d48a052e5891&fccid=82656d64a9a3e6a7&vjs=3,08-10-2022,
511, maharashtra,presales solutions architect : big data,databricks,mumbai  maharashtra,understanding of customer facing pre sales or consulting role with a core strength in either data engineering or data science advantageous ,,/rc/clk?jk=c6a30ffb566d5446&fccid=3d0f7ba22a49432f&vjs=3,08-09-2022,
512, maharashtra,solutions architect : presales   big data,databricks,mumbai  maharashtra,understanding of customer facing pre sales or consulting role with a core strength in either data engineering or data science advantageous ,,/rc/clk?jk=7a43a69baf06c321&fccid=3d0f7ba22a49432f&vjs=3,08-09-2022,
513, maharashtra,deputy manager assistant lead data science pune,vodafone,pune  maharashtra,provides deep technical analytical and data expertise to the business and other data scientists  using a wide variety of available data  to solve complex…,,/rc/clk?jk=16e067af147b1bbf&fccid=374d720d3973ca1c&vjs=3,08-09-2022,
514, kerala,visual analytics lead,prevalent ai,kochi  kerala,pai’s security data science platform  sds  is a big data security analytics platform that can ingest wide range of security telemetry data and apply advanced…,,/rc/clk?jk=2e72f7bd96bd452c&fccid=a17c77ae0e200a04&vjs=3,08-11-2022,
515, maharashtra,cloud analytics specialist  sre ,upl ltd,mumbai  maharashtra,build modern and secure ci cd pipelines to automate best practices development and deployment workflows used by data scientists  ml pipelines  and data…,,/rc/clk?jk=d4c532a7fadd4ea3&fccid=7f9e38c338b1c823&vjs=3,08-08-2022,
516, karnataka,einstein analytics   tableau crm developer,capco,bengaluru  karnataka,we are looking for strong data analyst with demonstrable experience of working in a data related role  data analysis  architecture  data structures   modelling …,,/rc/clk?jk=89292eac3c563b72&fccid=c2a63affe8751868&vjs=3,08-09-2022,
517, maharashtra,pre sales solutions architect  data   ai ,databricks,mumbai  maharashtra,understanding of customer facing pre sales or consulting role with a core strength in either data engineering or data science advantageous ,,/rc/clk?jk=3b3df5441a40e4da&fccid=3d0f7ba22a49432f&vjs=3,08-09-2022,
518, karnataka,associate  model risk management,capital one,bengaluru  karnataka,0 6 to 2 years of experience in r or python for large scale data analysis  you have hands on experience developing data science solutions using open source…,,/rc/clk?jk=73f02f185b8c77f2&fccid=b85c5070c3d3d8c8&vjs=3,08-09-2022,
519, karnataka,avp  business intelligence and analytics lead,standard chartered,bengaluru  karnataka,expert knowledge in data analysis  data integration  data modelling  database design  and data warehousing technology  relevant hr coes and gpos ,,/rc/clk?jk=03904de649a34f35&fccid=5249cd8e17163cb5&vjs=3,08-11-2022,
520, kerala,senior data science manager,nissan,thiruvananthapuram  kerala,experience in various statistical and machine learning models  data mining  and unstructured data analytics in corporate or academic research environments ,,/rc/clk?jk=276633c5bfd118ac&fccid=154ba50a8fca4d5c&vjs=3,08-08-2022,
521,india,senior ai ml developer,openeyes technologies,india,study and transform data science prototypes  convert machine learning models into apis for applications accessibility  train and retrain systems when necessary ,,/rc/clk?jk=f837de108984b3e2&fccid=49c1728c8e9d5dbb&vjs=3,08-13-2022,
522, karnataka,consulting sama analytics sr  ml engineer sr  consultant man   ,deloitte,bengaluru  karnataka,systems design experience  with the ability to architect and explain data analytics pipelines and data flows  experience in designing and deploying using one or…,,/rc/clk?jk=7fac9c77f7c93fe2&fccid=9e215d88a6b33622&vjs=3,08-13-2022,
523, maharashtra,cloud analytics specialist  sre ,upl na inc ,mumbai  maharashtra,build modern and secure ci cd pipelines to automate best practices development and deployment workflows used by data scientists  ml pipelines  and data…,,/rc/clk?jk=6282b27da4a5eaf4&fccid=bed42f8c7b64d685&vjs=3,08-08-2022,
524, karnataka,sr  associate  model risk management,capital one,bengaluru  karnataka,2  years of experience in r or python for large scale data analysis  you have hands on experience developing data science solutions using open source tools and…,,/rc/clk?jk=3564525fbb049e43&fccid=b85c5070c3d3d8c8&vjs=3,08-09-2022,
525, karnataka,senior software engineer  data science infrastructure,go jek,bengaluru  karnataka,manage data science infrastructure to streamline model development and deployment  you’ll employ your stellar software engineering skills and expertise in the…,,/rc/clk?jk=609d3cd5cc103d26&fccid=35c79097c1f63f3d&vjs=3,08-11-2022,
526, uttar pradesh,machine learning engineer 4,adobe,noida  uttar pradesh,strong experience with data transformation   etl on large data sets  create efficient data ingestion processes with low latency systems and data warehouses ,,/rc/clk?jk=25d722e3c903140f&fccid=f89deb5a97c7738a&vjs=3,08-11-2022,
528, karnataka,data scientist   fe,tookitaki holding pte ltd,bengaluru  karnataka,the data science team is responsible for solving business problems with complex data  big data experience  e g  familiarity with spark  hadoop  is highly…,,/rc/clk?jk=10f5a6cbb429b423&fccid=baa5a085a6dc8988&vjs=3,08-17-2022,
533, karnataka,data scientist   remote,promptcloud,remote in bengaluru  karnataka,familiarity with database queries and data analysis processes  sql  python   track record of leading  building  and deploying production nlp systems on large…,,/rc/clk?jk=90f614deb5592307&fccid=20005239fdea3244&vjs=3,08-11-2022,
537, karnataka,junior ai ml engineer,hutech solutions,bengaluru  karnataka,extensive knowledge of ml frameworks  libraries  data structures  data modeling  and software architecture  developing ml algorithms to analyze huge volumes of…,,/company/Hutech-Solutions/jobs/Junior-Ai-Ml-Engineer-b9d919b48183a495?fccid=7c7435c6188f613a&vjs=3,08-27-2022,
543, tamil nadu,data scientist,digitwin technology pvt ltd,temporarily remote in chennai  tamil nadu,digitwin technology pvt ltd   chennai  create   develop ml ai algorithms for industrial needs  statistics   good applied statistical skills  including knowledge…,,/company/Digitwin-Technology-Pvt-Ltd/jobs/Data-Scientist-e0122d1cf4ca78f5?fccid=84d654899eec044b&vjs=3,08-25-2022,
544, kerala,20 data scientist,uvj technologies,kochi  kerala,good knowledge in meteorological science  good programming experience in fortran   python   bash  experience in linux shell programming ,,/rc/clk?jk=8fad210de1aec9db&fccid=d1c3e6e342c9eef7&vjs=3,08-13-2022,
546, kerala,machine learning engineer,datamate infosolutions pvt  ltd,kochi  kerala,we are looking for professionals who have good knowledge in machine learning  nlp and deep learning  kochi  kerala: reliably commute or planning to relocate…,,/company/Datamate-Infosolutions/jobs/Machine-Learning-Engineer-af1e80c82b117155?fccid=ac1d6f210dfbb526&vjs=3,08-27-2022,
547, karnataka,senior data scientist,index exchange,remote in bengaluru  karnataka,demonstrated history of enabling advanced data modeling based guidance for technology development  design  develop  and drive implementation of complex data…,,/rc/clk?jk=5bda1387db4e5120&fccid=82179ab8760b598c&vjs=3,08-10-2022,
548, karnataka,data scientist,bitgo,bengaluru  karnataka,familiarity with data warehouse development and best practices  2  years industry experience in data analytics field for those with masters degree   3  years…,,/rc/clk?jk=1fbf6103f97cf647&fccid=b8e9ebc948f649d4&vjs=3,08-11-2022,
550, delhi,machine learning engineer,acme infosystem professionals,remote in delhi  delhi,familiarity with distributed data processing tools like spark  snowflake and dataiku  a solid understanding of statistical modelling machine learning data…,,/company/Acme-Infosystem-Professionals/jobs/Machine-Learning-Engineer-d76c8104443a72cc?fccid=0b4f457d13ee80d2&vjs=3,08-26-2022,
553, karnataka,lead  data science and analytics,gale,bengaluru  karnataka,experience with unsupervised clustering algorithms  especially on large data sets some experience with interactive visualization of data in shiney  d3 or dash…,,/rc/clk?jk=de69dae3a3b1499a&fccid=d65cf0e290d6bfe1&vjs=3,08-14-2022,
554, telangana,mid level ml engineers   data scientist,lyfe it solutions,hyderabad  telangana,previous experience in ml  data scientist or optimization engineer role with a large technology company  experience processing  filtering  and presenting large…,,/company/Lyfe-it-solutions/jobs/Mid-Level-Ml-Engineer-71437fd4f20c8195?fccid=d7ff37498e1669c7&vjs=3,08-12-2022,
556, karnataka,senior machine learning engineer,qualitas technologies,remote in bengaluru  karnataka,joining within    30 days  negotiable   job requirements include system design  interfacing and managing junior members of the team and hard core product…,,/company/Qualitas-Technologies/jobs/Senior-Machine-Learning-Engineer-48fb988886f4ed2e?fccid=2a07a9551bedb9bd&vjs=3,08-26-2022,
559, uttar pradesh,data science intern,clevered,remote in noida  uttar pradesh,1 candidate must have completed his her studies  the candidate must be have knowledge of    machine learning algorithms  classification  regression  clustering …,,/company/Clevered/jobs/Data-Science-Intern-70b92b663efbb812?fccid=8d88f5d4f899217b&vjs=3,08-27-2022,
560, karnataka,manager  data science and analytics,gale,bengaluru  karnataka,the candidate will be leading and managing a team of 2 5 junior data scientists   data scientists   senior data scientists   leads ,,/rc/clk?jk=aec91ebb99c6651f&fccid=d65cf0e290d6bfe1&vjs=3,08-14-2022,
561, karnataka,deep learning engineers   internship,conxai technologies gmbh,bengaluru  karnataka,you will support the building of prototypes on real world data  we are building the first no code ai platform for the construction industry  with the 3rd…,,/rc/clk?jk=2821120b9f839784&fccid=3223629b914c825f&vjs=3,08-09-2022,
563, tamil nadu,manager   product analytics,freshworks,chennai  tamil nadu,ensure that data and analysis is presented in a format that is appropriate for a varied audience using data visualization  dashboards  or other methods ,,/rc/clk?jk=6ece4102c8f291bc&fccid=37f39930e85bec2a&vjs=3,08-13-2022,
564,remote,remote staff machine learning engineer  usd compensation ,turing,remote,only candidates with 10  years of software development experience are eligible for this role    elite u s  jobs that provide higher salaries than local…,,/company/Turing/jobs/Staff-Machine-Learning-Engineer-dbea54321d185dae?fccid=9e91ba2e9cfc16b4&vjs=3,08-11-2022,
567, maharashtra,ciel sel 28116: data scientist,ciel hr services,pune  maharashtra,you can utilize all kinds of data sources  such as relational databases via sql  non relational databases  and any kind of web interface providing structured…,,/rc/clk?jk=57f24be2ef5f6d52&fccid=2b1e42f645eeaf1e&vjs=3,08-12-2022,
569, tamil nadu,deep learning engineer,client of p  s international hr consultants,chennai  tamil nadu,experienced in hyperparameter tuning  data augmentation  data wrangling  model optimization  and model deployment  total work: 1 year  preferred  ,,/company/P.-S-International/jobs/Deep-Learning-Engineer-6e6e55beca97d013?fccid=8e0910c65b0f554c&vjs=3,08-14-2022,
570,india,ai ml developer,openeyes technologies,india,study and transform data science prototypes  convert machine learning models into apis for applications accessibility  train and retrain systems when necessary ,,/rc/clk?jk=2c2426751d75f3e5&fccid=49c1728c8e9d5dbb&vjs=3,08-11-2022,
571,remote,remote senior machine learning engineer  python and c   ,turing,remote,establishing the infrastructure for preparing data and production grade data pipelines for text video training  experience in python or c   ,,/company/Turing/jobs/Senior-Machine-Learning-Engineer-0096fcce19a9f161?fccid=9e91ba2e9cfc16b4&vjs=3,08-16-2022,
572, karnataka,python programming language data science practitioner,accenture,bengaluru  karnataka,project role description :manage  architect and analyze big data in order to build data driven insights and high impact data models ,,/rc/clk?jk=067b9924097a1797&fccid=a4e4e2eaf26690c9&vjs=3,08-03-2022,
573, karnataka,ai architect,infosys limited,bengaluru  karnataka,a comprehensive understanding of the principles and best practices behind data engineering  and the supporting technologies such as rdbms  nosql  cache   in…,,/rc/clk?jk=33c73a2132916cab&fccid=c67533a523c83a4c&vjs=3,08-03-2022,
574, karnataka,data scientist,honeywell,bengaluru  karnataka,mine and analyze data from company databases to drive optimization and improvement of data quality  enhancing data quality using ai ml based approaches ,,/rc/clk?jk=d27f39a6a619b942&fccid=50208b5bf45ee3b8&vjs=3,08-03-2022,
575, maharashtra,machine learning engineer,botways tech,wakad  pune  maharashtra,select appropriate datasets and data representation methods  understanding of data structures  data modeling and software architecture ,,/rc/clk?jk=83c5d8b81184dc41&fccid=5dc984055144a551&vjs=3,08-05-2022,
576, karnataka,data scientist,aienterprise,bengaluru  karnataka,experience writing sql codes for data exploration  experience or willingness to learn tools to create data pipelines using airflow ,,/rc/clk?jk=d11c36503cc26496&fccid=89fc9bfba1bf23b7&vjs=3,08-01-2022,
577, karnataka,data science consultant   operation research,encore theme,bengaluru  karnataka,"you should be able to build a custom function module with medium complexity program logic  minimum work experience: 5   8 years ""as a consultant  you should…",,/rc/clk?jk=4a8c7d96b4c02481&fccid=68467f8543d168c0&vjs=3,08-03-2022,
578, karnataka,risk   ccb   fraud risk  data science    associate,jpmorgan chase bank  n a ,bengaluru  karnataka,"perform ad hoc exploratory statistics and data mining tasks on diverse datasets from small scale to ""big data"" ",,/rc/clk?jk=b39d0675550a246f&fccid=aaf3b433897ea465&vjs=3,08-05-2022,
579, karnataka,data science engineer   pulse,cgi inc,bengaluru  karnataka,experience in data processing using traditional and distributed systems  e g mongodb  airflow   master’s degree in computer science  related technical field or…,,/rc/clk?jk=54c862f05ed58002&fccid=43a69183767d4301&vjs=3,08-06-2022,
580, karnataka,applied scientist ii,aispl   tamil nadu,bengaluru  karnataka,phd in electrical engineering  computer science  mathematics or physics with specialization in speech recognition  natural language processing  machine…,,/rc/clk?jk=873560bd6b0b18cb&fccid=fe2d21eef233e94a&vjs=3,08-02-2022,
581, karnataka,associate   machine learning engineer,ey,bengaluru  karnataka,experience with data wrangling techniques preprocessing and post processing requirements for ml solutions  executes relevant data wrangling activities related…,,/rc/clk?jk=a9359a86aa14479a&fccid=1544766d4c2915b0&vjs=3,08-04-2022,
582, karnataka,ai architect,ibm,bengaluru  karnataka,proven ability in solutioning covering data ingestion  data cleansing  etl  data mart creation and exposing data for consumers ,,/rc/clk?jk=25401a53e600d43f&fccid=de71a49b535e21cb&vjs=3,08-07-2022,
583, karnataka,data scientist,fusemachines,bengaluru  karnataka,design  develop and optimize data pipelines to support analytics products   using azureml  pyspark and other python libraries  mlops experience is a plus ,,/rc/clk?jk=8cf3461be49030a2&fccid=b711a2a28448b767&vjs=3,08-04-2022,
584, haryana,associate consultant   tech consulting   national   data   a   ,ey,gurgaon  haryana,data migration  big data activities    analyze data in existing data warehouse  understand target data model  develop scripts to move data from the existing…,,/rc/clk?jk=c5e3029d457f739a&fccid=1544766d4c2915b0&vjs=3,08-06-2022,
585, karnataka,data scientist,simpplr,bengaluru  karnataka,develop scalable algorithms using nlp  deep learning that work well with high volumes of structured and unstructured data ,,/rc/clk?jk=7beaa8f69035f834&fccid=598d65d7db19fd4d&vjs=3,08-02-2022,
586, karnataka,analyst ii  global hr data analytics,harman international,bengaluru  karnataka,participate in prism data model design  knowledge and understanding of data manipulation is essential  concisely summarize data to create compelling analyses…,,/rc/clk?jk=4664ca1f745acf19&fccid=4faf342d2307e9ed&vjs=3,08-01-2022,
587, maharashtra,data scientist,siemens,pune  maharashtra,5  years of experience in data scientist role  you will be part of siemens advanta energy team with long time experience in collecting operational data of power…,,/rc/clk?jk=21049693b66ba21e&fccid=ea6bb53f0b18b8f2&vjs=3,08-06-2022,
588, kerala,ai ml architect,ey,thiruvananthapuram  kerala,gathers data on implementation outcomes  follows standards  processes and methodologies to develop each phase of data architecture  e g   data manipulating…,,/rc/clk?jk=6e5ebcd8d29cf185&fccid=1544766d4c2915b0&vjs=3,08-07-2022,
589, telangana,data scientist,cognitivecare,remote in hyderabad  telangana,setting up data infrastructure to store and analyze data for getting information and insights from data to find answers to specific questions ,,/rc/clk?jk=15ae477c0c20a92f&fccid=c63acafb46099a4e&vjs=3,08-02-2022,
590, delhi,data scientist,razorgroup,delhi  delhi,you developing quantitative models  leveraging machine learning and advanced data analysis techniques to  dealing with evolving and complex data schemas is a…,,/rc/clk?jk=25053ff05731ca73&fccid=8aea627ebf4bbb2f&vjs=3,08-02-2022,
591, karnataka,data scientist,ibm,bengaluru  karnataka,expertise in deep data and analytics  enhance performance by applying advanced mathematical modeling  data analytics  optimization  and machine learning…,,/rc/clk?jk=2dd2b9850643086f&fccid=de71a49b535e21cb&vjs=3,08-02-2022,
592, karnataka,data scientist   risk platform,go jek,bengaluru  karnataka,collaborate with analysts  data scientists  product managers  validation teams across the risk organization  this will entail identifying relevant data sources …,,/rc/clk?jk=45fc30e51ca23961&fccid=35c79097c1f63f3d&vjs=3,08-05-2022,
593, tamil nadu,data scientist   marketing analytics,shell,chennai  tamil nadu,manage and drive the data collection part and setup guidelines on the data format  assess data availability and modeling feasibility ,,/rc/clk?jk=306f98fd8c10ad53&fccid=167aa4ca2fe7d8e6&vjs=3,08-03-2022,
594, telangana,people analytics   reporting   data visualization   analyst,deloitte,hyderabad  telangana,ensure quality deliverables through proper data extraction  data cleanup  formatting  and data validation  must have real time experience to develop new tableau…,,/rc/clk?jk=54e233ec4aacdce0&fccid=9e215d88a6b33622&vjs=3,08-02-2022,
595, maharashtra,senior data scientist,nice,pune  maharashtra,guardian analytics is seeking data scientists  mathematicians statisticians  and computer scientists to develop  analyze and program cutting edge algorithms…,,/rc/clk?jk=df5d7880609f27ba&fccid=48d865ee21517f2f&vjs=3,08-04-2022,
