,State,Job,Companies,Location,Summary,Salary,Links,Post_Date,og_salary_period
401,remote,remote senior data analyst scientist  sql and python ,turing,remote,architect data warehouse models and semantic layers with query optimizations in mind  a minimum of 5  years of relevant experience in data science  data…,,/company/Turing/jobs/Senior-Data-Analyst-Scientist-8b1ef69a399b395e?fccid=9e91ba2e9cfc16b4&vjs=3,08-25-2022,
402, karnataka,ciel sel 26426: lead data scientist,ciel hr services,bengaluru  karnataka,support  review and conduct complex analytics processes and data integration on clients’ internal and external data  expedience crm analytics would be a plus ,,/rc/clk?jk=b571524d907fa7a1&fccid=2b1e42f645eeaf1e&vjs=3,08-18-2022,
403,remote,remote technical business development lead  python and machi   ,turing,remote,based in palo alto  california  turing aims to unleash the world’s untapped human potential  we use ai to source  evaluate  hire  onboard  and manage engineers…,,/company/Turing/jobs/Technical-Business-Development-Lead-ee512f7f87cfc0b0?fccid=9e91ba2e9cfc16b4&vjs=3,08-25-2022,
404, karnataka,senior ml engineer,entropik tech,bengaluru  karnataka,ability to use data from sql nosql sources and doing basic data manipulation  understanding of ml algorithms and data science libraries like numpy  pandas …,,/rc/clk?jk=68c7a86349db9fd8&fccid=a1894aca68d28bc8&vjs=3,08-20-2022,
405, maharashtra,data science,deloitte,mumbai  maharashtra,graduate in economics   statistics   accounts  data science  b  tech or any other relevant degree  at least 3 years of experience in data science and analysis…,,/rc/clk?jk=b97e74c21789e8c2&fccid=9e215d88a6b33622&vjs=3,08-13-2022,
406, karnataka,data scientist  sr associate,jpmorgan chase bank  n a ,bengaluru  karnataka,strong understanding of advanced data mining techniques  curating  processing and transforming data to produce sound datasets  key requirements of the role:,,/rc/clk?jk=5a3d9151510bdb21&fccid=aaf3b433897ea465&vjs=3,08-12-2022,
407, karnataka,experimentation data scientist   chase,jpmorgan chase bank  n a ,bengaluru  karnataka,help the lob stakeholders innovate through data driven decisioning by analyzing data from diverse data sources to create rich insights that enable better…,,/rc/clk?jk=3f406af616f63220&fccid=aaf3b433897ea465&vjs=3,08-09-2022,
408, madhya pradesh,data science data science practitioner,accenture,indore  madhya pradesh,project role description :manage  architect and analyze big data in order to build data driven insights and high impact data models ,,/rc/clk?jk=30d025324d95a91f&fccid=a4e4e2eaf26690c9&vjs=3,08-09-2022,
409, karnataka,data scientist   gopay,go jek,bengaluru  karnataka,we are looking for a data scientist to join our data science team at gopay   you will create models which help grow the customer base and transactions in gopay ,,/rc/clk?jk=acb4f7e54ebef90c&fccid=35c79097c1f63f3d&vjs=3,08-08-2022,
410, karnataka,data scientist,brillio,bengaluru  karnataka,experience using statistical computer languages python to manipulate data and draw insights from large data sets  experience with machine learning on cloud ,,/rc/clk?jk=966d93ced62b2333&fccid=a2520645450d003a&vjs=3,08-09-2022,
411, telangana,junior data scientist,soothsayer analytics,hyderabad  telangana,collaborate with other engineers  data scientists  and product business people  solve cutting edge  challenging problems working alongside a great team of world…,,/rc/clk?jk=e0c62ba9c5dc8d2e&fccid=7eea1f754f48fabf&vjs=3,08-12-2022,
412, karnataka,data analyst,kinara capital,bengaluru  karnataka,clean and prepare data for analysis  the core foundation we look for is an aptitude with mathematics  and a competent ability with data science languages and…,,/rc/clk?jk=3ec12b17ab2261d0&fccid=f88cfbb7c87d526d&vjs=3,08-12-2022,
413, haryana,data analyst   data scientist,procol tech,gurgaon  haryana,identify new internal and external data sources to support analytics initiatives and work with appropriate partners to absorb the data into new or existing data…,,/rc/clk?jk=d7d26f70cffe0771&fccid=878b2621645c497d&vjs=3,08-10-2022,
414, karnataka,transformation lead  healthcare and data science,bosch group,bengaluru  karnataka,data science horizontal offers solutions and services to improve client businesses by deploying data science capabilities at scale ,,/rc/clk?jk=45b5b9bcf1eb8ca0&fccid=a2faf1301ac6ad4b&vjs=3,08-13-2022,
415, delhi,digitalbcg | gamma data scientist,boston consulting group,new delhi  delhi,are able to explain sophisticated data science concepts in an understandable manner  in this role  you’ll have the chance to roll up your sleeves and apply data…,,/rc/clk?jk=1d3dfdd97804b026&fccid=b95f9eb47968fa13&vjs=3,08-11-2022,
416, karnataka,data scientist   risk fraud l1,go jek,bengaluru  karnataka,collaborate with analysts  data scientists  product managers  validation teams across the risk org  this will entail identifying relevant data sources …,,/rc/clk?jk=67d05e37a95ebfe9&fccid=35c79097c1f63f3d&vjs=3,08-12-2022,
417, telangana,associate data scientist,s p global,hyderabad  telangana,to create data regression models  using predictive data modelling and analysing data mining algorithms to deliver insights and implement action oriented…,,/rc/clk?jk=941d2ac40a6249f2&fccid=b716e44d2c6283e7&vjs=3,08-12-2022,
418, karnataka,data science developer,abb,bengaluru  karnataka,you will be primarily responsible to support the sales assigned organization  division   market  and customers throughout the proposal process by preparing…,,/rc/clk?jk=4109a1200b7d5765&fccid=38b4474838e7b7a1&vjs=3,08-13-2022,
419, maharashtra,data scientist,futurism,pune  maharashtra,expert in python programming language  proficient in using business intelligence tools  e g  tableau  and data frameworks  e g  hadoop  ,,/rc/clk?jk=9761de8794c7284a&fccid=2dfd0c9aa351a953&vjs=3,08-09-2022,
420, karnataka,data science consultant,itc infotech india ltd,bengaluru  karnataka,3 to 7 years of experience associated with core data science model development  validation and monitoring of models and deploying models in production   very…,,/rc/clk?jk=a7a4dd45793252bd&fccid=47cca1a92b73a5b2&vjs=3,08-09-2022,
421, karnataka,vp   data scientist  ai ml lead ,jpmorgan chase bank  n a ,bengaluru  karnataka,analyze data  identify patterns  visualize outcome while working iteratively with business  collaborate with all of asset and wealth management lines of…,,/rc/clk?jk=52e3553382235256&fccid=aaf3b433897ea465&vjs=3,08-08-2022,
422, telangana,data scientist ml ops,gramener,hyderabad  telangana,turns reference implementations of ml models developed by data scientists into production ready software  works with data scientists and other ml engineers to…,,/rc/clk?jk=1e07e9b7bbcc4725&fccid=b2a8fbbe8042270a&vjs=3,08-10-2022,
423,remote in punjab,python developer data scientist ,icav tech,remote in punjab,key fundamentals in object iented design  data structures and systems  as a developer you will devote in all ongoing   upcoming projects   wk alongside other…,,/rc/clk?jk=e9d5961b949be485&fccid=a000d4e4766952a6&vjs=3,08-12-2022,
424, karnataka,senior data scientist,oracle,bengaluru  karnataka,the data science team at oracle analytics works on diverse data science ml problems on enterprise data such as invoice payment prediction  churn prediction …,,/rc/clk?jk=88d46c7de6eaf3d4&fccid=cd22d01053af7669&vjs=3,08-13-2022,
425, karnataka,senior data scientist,walmart global tech india,bengaluru  karnataka,direct the gathering of data  assessing data validity and synthesizing data into large analytics datasets to support project goals ,,/rc/clk?jk=21c33a801557f1c6&fccid=0d167dde0758739a&vjs=3,08-10-2022,
426, karnataka,ai ml engineer,siemens,bengaluru  karnataka,experience in etl with different data types  timeseries  images etc   and data sources  conduct exploratory analysis and ensure data adequacy ,,/rc/clk?jk=4bdf0edf422879fe&fccid=ea6bb53f0b18b8f2&vjs=3,08-10-2022,
427,remote in india,data scientist,tribolatech,remote in india,ability to apply the scientific method to create data experiments  train novel data models and deliver prescriptive and predictive data models ,,/rc/clk?jk=8babe08cb0941fb3&fccid=975f6b944a2d1638&vjs=3,08-10-2022,
428, karnataka,staff data scientist,walmart global tech india,bengaluru  karnataka,play a key role to solve complex problems  pivotal to walmart’s business and drive actionable insights from terabytes of data ,,/rc/clk?jk=91c81c5c1aaed399&fccid=0d167dde0758739a&vjs=3,08-10-2022,
429, maharashtra,data scientist,global industrial,mumbai  maharashtra,develop custom data models and algorithms to apply to data sets  assess the effectiveness and accuracy of new data sources and data gathering techniques ,,/rc/clk?jk=18d4d94982144c1b&fccid=12ceb7af3aadea5c&vjs=3,08-09-2022,
430, karnataka,intern  jr data scientist,corner tree consulting,bengaluru  karnataka,students pursuing phd  mtech me or btech be in cse or related specializations  practical exposure to kalman filters  bayesian methods  statistical signal…,,/rc/clk?jk=0ad7b95f48d2a513&fccid=d44ea6f899bd29b4&vjs=3,08-10-2022,
431, maharashtra,machine learning engineer,appzen,pune  maharashtra,communicate proposals and results in a clear manner backed by data and coupled with actionable conclusions to drive business decisions ,,/rc/clk?jk=6948a63f6799ab86&fccid=232d2677a5ec1087&vjs=3,08-11-2022,
432, karnataka,microsoft azure machine learning application developer,accenture,bengaluru  karnataka,technical experience : a  4 3 years of strong experience on microsoft azure  aspnet   mvc and general purpose programming languages such as c vbnet b  6 months…,,/rc/clk?jk=b05860ec152633db&fccid=a4e4e2eaf26690c9&vjs=3,08-12-2022,
433, tamil nadu,pms data scientist expert,philips,hybrid remote in chennai  tamil nadu,passion for empirical research and for answering hard questions with data  ability to manipulate and analyze complex  high volume  high dimensionality data from…,,/rc/clk?jk=606c85bad23d7967&fccid=e4af9ca5b6d3a604&vjs=3,08-12-2022,
434, karnataka,data scientist,terarecon  inc,bengaluru  karnataka,develop data collection protocol  annotation protocol  pre process data  train models  perform model optimization and work with ai core imaging platform…,,/rc/clk?jk=846f0470639daf36&fccid=a3a4e68b447ea169&vjs=3,08-12-2022,
435, delhi,data   analytics manager  geo analytics   gamma,boston consulting group,new delhi  delhi,we design algorithms and build complex models out of large amounts of data  demonstrated handling  processing  and deriving insights from remotely sensed data…,,/rc/clk?jk=07a8f2d82207160e&fccid=b95f9eb47968fa13&vjs=3,08-11-2022,
436, telangana,data scientist nlp,gramener,hyderabad  telangana,preparing data to train and test models  through a host of our product and service offerings we analyse and visualize large amounts of data ,,/rc/clk?jk=91ef6cb09a3e5bed&fccid=b2a8fbbe8042270a&vjs=3,08-10-2022,
437, karnataka,lead   responsible ai,nasscom,bengaluru  karnataka,strategy   build the foundation for an extensive rollout and adoption of responsible ai in india  define a roadmap for adoption of responsible ai by start ups …,,/rc/clk?jk=6a47da4e2ea54454&fccid=24ee567c58df5104&vjs=3,08-12-2022,
438, maharashtra,spec analytics analyst 2  tts,citi,pune  maharashtra,this will involve leveraging multiple analytical approaches  tools and techniques  working on multiple data sources  client profile   engagement data …,,/rc/clk?jk=912451ab24a504f6&fccid=5bcd1ef0a7f4fb99&vjs=3,08-13-2022,
439, karnataka,sr advanced data scientist,honeywell,bengaluru  karnataka,excellent in data analytics and data mining  5  years experience with real data  critical thinking: ability to track down complex data issues having business…,,/rc/clk?jk=1faceb4b26cfa2b0&fccid=50208b5bf45ee3b8&vjs=3,08-12-2022,
440, tamil nadu,digitalbcg| gamma senior data scientist,boston consulting group,chennai  tamil nadu,recent phd or master’s degree in computer science  applied mathematics  statistics  machine learning  or other data centric disciplines with 7  years of…,,/rc/clk?jk=72c943d100743044&fccid=b95f9eb47968fa13&vjs=3,08-11-2022,
441, telangana,nlp engineer,s p global,hyderabad  telangana,study and transform data science prototypes  understanding of nlp techniques for text representation  semantic extraction techniques  data structures and…,,/rc/clk?jk=9329c485c6aa8799&fccid=b716e44d2c6283e7&vjs=3,08-11-2022,
442, karnataka,principal data scientist,walmart global tech india,bengaluru  karnataka,direct the gathering of data  assessing data validity and synthesizing data into large analytics datasets to support project goals ,,/rc/clk?jk=e9b27d49ed5bc4c2&fccid=0d167dde0758739a&vjs=3,08-10-2022,
443, karnataka,advanced data scientist,honeywell,bengaluru  karnataka,experience in end to end development of computer vision based model development included devising data set strategy  selecting model architecture …,,/rc/clk?jk=75ed534b3d4e18ca&fccid=50208b5bf45ee3b8&vjs=3,08-10-2022,
444, karnataka,consultant  data scientist,grant thornton bharat,bengaluru  karnataka,should have comprehensive experience in data preparation techniques for both structured and unstructured data  hands on experience with chatbots ,,/rc/clk?jk=1a6658e64ffdc332&fccid=7ac82fceed64aa81&vjs=3,08-11-2022,
445, karnataka,quant analytics associate,jpmorgan chase bank  n a ,bengaluru  karnataka,experience with data automation or data wrangling etl tools such as alteryx  trifecta or equivalent  the team encompasses a variety of disciplines from data…,,/rc/clk?jk=2310cd649a763fc7&fccid=aaf3b433897ea465&vjs=3,08-13-2022,
446, karnataka,staff data engineer   flight data and analytics team,ge aviation,bengaluru  karnataka,ability to understand logical and physical data models  big data storage architecture  data modeling methodologies  exposure with big data   hadoop   hive ,,/rc/clk?jk=433dc1613e6286e1&fccid=aac6f2070b0f3775&vjs=3,08-10-2022,
447, maharashtra,data analytics manager,axis my india,mumbai  maharashtra,collaborate with internal stakeholders to manage data logistics  including data transfers  understanding data structures  business rules  business processes and…,,/rc/clk?jk=043439098e7462ce&fccid=f1d9bc3b339684dc&vjs=3,08-10-2022,
448, karnataka,sr mgr i   data analytics  mint ,walmart global tech india,bengaluru  karnataka,work with product  engineering  data science and business teams to drive complex data and trend analyses to root cause issues and propose ways to improve…,,/rc/clk?jk=6b79e6f7ff793da6&fccid=0d167dde0758739a&vjs=3,08-12-2022,
449, maharashtra,ccb risk   strategic analytics fraud   associate,jpmorgan chase bank  n a ,mumbai  maharashtra,think analytically with the ability to synthesize large sets of data into the key themes  4 7 years' experience in risk management  strategic analytics  or data…,,/rc/clk?jk=fba584f02da81f01&fccid=aaf3b433897ea465&vjs=3,08-11-2022,
451, maharashtra,data engineer   data science   analytics,transunion,pune  maharashtra,you’ll define and implement processes that enable and streamline the ongoing integration and consistency of new non traditional credit bureau  alternative  data…,,/rc/clk?jk=40b52e84803392ce&fccid=663ece44ae074b32&vjs=3,08-09-2022,
452, karnataka,analyst artificial intelligence innovation,accenture,bengaluru  karnataka,in this role  you will be working on the interdisciplinary field about scientific methods  processes and systems to extract knowledge or insights from data in…,,/rc/clk?jk=016114059a2bf12d&fccid=a4e4e2eaf26690c9&vjs=3,08-11-2022,
453, madhya pradesh,machine learning application lead,accenture,indore  madhya pradesh,technical experience : a drive the vision for modern data and analytics platform to deliver well architected  engineered data and analytics products b ensure…,,/rc/clk?jk=ea6f672207b94256&fccid=a4e4e2eaf26690c9&vjs=3,08-09-2022,
454, karnataka,data scientist   risk analytics,paypal,bengaluru  karnataka,the role requires an analytically driven senior data scientist who embodies paypal values and customer centric approach ,,/rc/clk?jk=c3e7e58065166f8e&fccid=978d9fd9799d55a8&vjs=3,08-10-2022,
455, karnataka,applied scientist  traffic quality   3ps,adci   karnataka,bengaluru  karnataka,an ideal candidate should have strong depth and breadth knowledge in machine learning  data mining and statistics  experience working on advertising solutions ,,/rc/clk?jk=0bb23fb6992fb189&fccid=fe2d21eef233e94a&vjs=3,08-11-2022,
456, karnataka,machine learning engineer,qcom,bengaluru  karnataka,engineering group  engineering group > machine learning engineering  understanding various frameworks and solutions to integrate qranium software stack within…,,/rc/clk?jk=5066f92640c9ff04&fccid=d40ebe11fc879426&vjs=3,08-10-2022,
457, maharashtra,sr  data scientist   advanced analytics,eaton,pune  maharashtra,strategizes new uses for data and its interaction with data design  conducts scalable data research  identifies opportunities to collect new data ,,/rc/clk?jk=e1b72f4ad9587308&fccid=87f38351bd29de24&vjs=3,08-12-2022,
458, maharashtra,senior analyst data science,accenture,mumbai  maharashtra,in the data science team  you will manage and analyze data in order to build data driven business insights and high impact data models to generate significant…,,/rc/clk?jk=01adc2210c6cfd04&fccid=a4e4e2eaf26690c9&vjs=3,08-09-2022,
459, karnataka,swqm data scientist,mercedes benz research and development india   ,bengaluru  karnataka,champion effective user interfaces for displaying and manipulating data analysis  provide big data  programming  and automotive field failure expertise ,,/rc/clk?jk=0c2dc8a42701a50a&fccid=b25343f021fb51d7&vjs=3,08-10-2022,
460, karnataka,market risk   java   big data   cloud,jpmorgan chase bank  n a ,bengaluru  karnataka,develop robust  performant software products in an agile environment  interfacing closely with the business  quantitative research analysts  and upstream as…,,/rc/clk?jk=9c9d83837b3a9751&fccid=aaf3b433897ea465&vjs=3,08-08-2022,
461, telangana,data scientist   smart mfg   ai,micron,hyderabad  telangana,ability to extract data from different databases via sql and other query languages and apply data cleansing  outlier identification  and missing data techniques…,,/rc/clk?jk=994404bcab3629f1&fccid=be240c643a8631c5&vjs=3,08-13-2022,
462, kerala,data scientist,calpine group,kochi  kerala,good knowledge in meteorological science good programming experience in fortran   python   bash experience in linux shell programming ,,/rc/clk?jk=df7f3821f989cb0e&fccid=b6c30111840620e9&vjs=3,08-11-2022,
463, maharashtra,data scientist,savic,mumbai  maharashtra,able to convey stories told by the data and presents them to other scientists  proven experience in translating business challenges into data pipelines   model…,,/rc/clk?jk=6eed4e1eedb7f43a&fccid=aabe32b1586459a5&vjs=3,08-13-2022,
464, maharashtra,data scientist   visualizer,axis my india,mumbai  maharashtra,should be adept at data understanding and analysis  you would drive data analytics from the customer viewpoint  employment type : full time  permanent ,,/rc/clk?jk=a68996b549a71ef6&fccid=f1d9bc3b339684dc&vjs=3,08-10-2022,
465, kerala,data scientist,nissan,thiruvananthapuram  kerala,experience in various statistical and machine learning models  data mining  unstructured data analytics in corporate or academic research environments ,,/rc/clk?jk=542b02256f444aba&fccid=154ba50a8fca4d5c&vjs=3,08-08-2022,
466, maharashtra,consultant specialist cto,hsbc,pune  maharashtra,acquire data from primary or secondary data sources and maintain databases data systems  responsible for the development and maintenance of data models …,,/rc/clk?jk=82cc1b45874bc456&fccid=04c9b139c84ea1b5&vjs=3,08-11-2022,
467, rajasthan,data scientist,advanced technology consulting service  atcs ,jaipur  rajasthan,working experience on unstructured data  handling of high volume data using python pyspark  understanding of data engineering concepts ,,/rc/clk?jk=49694671bf506dc4&fccid=56301517d698516a&vjs=3,08-09-2022,
468, karnataka,software developer machine learning,zeomega infotech,bengaluru  karnataka,able to validate various data ingestion and data processing mechanisms wrt ml models  experience in visualization of data  knowledge in us healthcare domain ,,/rc/clk?jk=e78ef71c55636088&fccid=163f50b24be4e6fc&vjs=3,08-13-2022,
469, karnataka,business intel engineer  in fc analytics,asspl   karnataka,bengaluru  karnataka,knowledge of data management fundamentals and data storage principles  experience building data products incrementally  integrating and managing large data sets…,,/rc/clk?jk=8bc4a122f01fc877&fccid=fe2d21eef233e94a&vjs=3,08-11-2022,
470, karnataka,sr  applied scientist  trans ai,adci   blr 14 sez,bengaluru  karnataka,strong communication and data presentation skills  you will analyze and model terabytes of data to solve real world problems ,,/rc/clk?jk=3498378f5a8abb01&fccid=fe2d21eef233e94a&vjs=3,08-12-2022,
472, karnataka,sr  analyst manufacturing data analytics india,kennametal  inc ,bengaluru  karnataka,provide feedback to existing data collection database management procedures to improve data quality  experience working with high frequency and large volume of…,,/rc/clk?jk=bf059e745097aa3e&fccid=6e3ab497868f8cc6&vjs=3,08-08-2022,
473, maharashtra,pre sales solutions architect  big data ,databricks,mumbai  maharashtra,understanding of customer facing pre sales or consulting role with a core strength in either data engineering or data science advantageous ,,/rc/clk?jk=8fefe8a572893410&fccid=3d0f7ba22a49432f&vjs=3,08-09-2022,
474, karnataka,data scientist iii,sixt india,bengaluru  karnataka,you will assist other engineers in designing the right data models  you have experience working with large amounts of real data with sql or nosql ,,/rc/clk?jk=f8f93b34dfea968f&fccid=02d9f415fafcdcf3&vjs=3,08-13-2022,
476, karnataka,senior data scientist,hudson's bay company,bengaluru  karnataka,4  years of relevant data science experience  ability to handle large sets and interpret data  applies scripting programming skills to assemble various types of…,,/rc/clk?jk=0ca9f86050b6595f&fccid=fe5fae2f1befbc52&vjs=3,08-13-2022,
477, tamil nadu,visualization expert,ford global business services,chennai  tamil nadu,exposure to bigdata based analytical solutions and hands on experience with data lakes   experience with sql and data warehousing  e g   teradata oracle db2  ,,/rc/clk?jk=daf1d29c344f9568&fccid=35c29eb190cc370d&vjs=3,08-13-2022,
478, punjab,machine learning   python developer  3 6 years ,harmony data integration technologies,remote in mohali  punjab,capability of integrating data from numerous sources into a single system  machine learning   python developer  3 6 years  ,,/rc/clk?jk=fcdf70d807776ab9&fccid=0e967721b35b5f0b&vjs=3,08-10-2022,
479, telangana,manager data science,providence global center,hyderabad  telangana,enable data scientists to create forecasting and machine learning models by working along with business analyst  product managers and data analytics engineers…,,/rc/clk?jk=ac7e0b9c564a5705&fccid=ed2628577ca2cad6&vjs=3,08-11-2022,
480, karnataka,staff engineer   machine learning   customer engineering,52 qualcomm india private limited,bengaluru  karnataka,live and breathe quality software development with excellent analytical and debugging skills  strong understanding of deep learning fundamentals ,,/rc/clk?jk=f3fa75c3b44b9806&fccid=dd616958bd9ddc12&vjs=3,08-10-2022,
481,temporarily remote in india,ai engineer  india ,qio technologies,temporarily remote in india,you will review the data coming in from different sources  analyse and identify the necessary input data and where to obtain it  how best to combine with other…,,/rc/clk?jk=6851becfb6bd318f&fccid=a1a5f6c33c45f989&vjs=3,08-10-2022,
482,temporarily remote in india,data science engineer  india ,qio technologies,temporarily remote in india,familiar with concepts and technologies around software as a service  saas   big data  cloud  industry 4 0  ot  iot  iiot and mes ,,/rc/clk?jk=73242d03107c1daf&fccid=a1a5f6c33c45f989&vjs=3,08-10-2022,
483, karnataka,data analytics manager,aispl   karnataka,bengaluru  karnataka,proficiency in using python   carrying out data analytics projects and able to understand various data structures and common methods in data transformation ,,/rc/clk?jk=ef534b3f75c81eb0&fccid=fe2d21eef233e94a&vjs=3,08-11-2022,
484, karnataka,lead data scientist data engineer   python,société générale,bengaluru  karnataka,understanding the data that will be available on source systems in business terms and provide complete solution based on those data understanding for end users ,,/rc/clk?jk=5c5ae2dc656d45a9&fccid=df6948c9b8da6236&vjs=3,08-12-2022,
485,uttar pradesh,sr mgr  biz  transformation  amazon fulfillment machine lear   ,adci   haryana,uttar pradesh,5  years managing teams with large data handling and cross team scope  strong analytical and quantitative skills with the ability to use data and metrics to…,,/rc/clk?jk=4292b90a3d87e944&fccid=fe2d21eef233e94a&vjs=3,08-10-2022,
486, karnataka,manager  ai verticalization,uniphore,bengaluru  karnataka,identifying areas for improvement in various ai modules via a thorough benchmarking strategy including data specification and plans for data curation ,,/rc/clk?jk=cba9c4a3211cbd2f&fccid=34f8c7d77241eaa8&vjs=3,08-09-2022,
487, maharashtra,deputy manager assistant lead data scientist pune,vodafone,pune  maharashtra,presents data in charts  graphs  tables  designing and developing relational databases for collecting data and building or designing data input or data…,,/rc/clk?jk=7fd33f0be52a6046&fccid=374d720d3973ca1c&vjs=3,08-12-2022,
